{
  "schema_version": 1,
  "status": "failed",
  "agent_next_step": "inspect-agent-decision-fixtures",
  "summary_json": "docs/fixtures/agent-decision-client-consumer-smoke-summary/fixture-drift.json",
  "evidence": {
    "helper_ref": "v0.5.21",
    "fixture_count": 7,
    "decisions": [
      "accept",
      "accept",
      "accept",
      "manual-review",
      "manual-review",
      "manual-review",
      "apply-repair"
    ],
    "result_json": "/tmp/testloop-agent-decision-template-install/testloop-agent-decision-client/agent-decision-fixtures-result.json",
    "client_summary_json": "/tmp/testloop-agent-decision-template-install/testloop-agent-decision-client-summary.json",
    "client_summary_validator_json": "/tmp/testloop-agent-decision-consumer-smoke/client-summary-validation.json",
    "client_response_json": "/tmp/testloop-agent-decision-consumer-smoke/client-response.json",
    "client_response_validator_json": "/tmp/testloop-agent-decision-consumer-smoke/client-response-validation.json",
    "workflow_path": "/tmp/testloop-agent-decision-consumer-smoke/external-client/.github/workflows/testloop-agent-decision-contract.yml",
    "install_summary_validator_exit_code": 0,
    "client_summary_validator_exit_code": 0,
    "client_response_validator_exit_code": 1,
    "fixture_validator_exit_code": 0,
    "npm_validator_exit_code": 0
  },
  "failures": [
    "summary status is failed",
    "consumer smoke failure: fixture manifest drift: expected 8 agent decision fixtures",
    "client_response_validator_exit_code=1",
    "fixture_count=7, want 8",
    "decisions must be accept,accept,accept,manual-review,manual-review,manual-review,apply-repair,needs-better-input"
  ]
}
